{
  "$schema": "schemas/event-catalogue.schema.json",
  "schema_version": "1.0.0",
  "catalogue_version": "pilot-0.2",
  "unknown_event_policy": "fail_closed",
  "entries": [
    {
      "schema_version": "1.0.0",
      "event_type": "RunCreated",
      "event_type_version": "1.0.0",
      "payload_schema_ref": "generic-event-payload.schema.json",
      "payload_schema_version": "1.0.0",
      "trigger": "run allocation",
      "source": "run_controller",
      "logical_time": {},
      "identity_lineage": {},
      "causal_refs": {},
      "state_refs": {},
      "visibility": {},
      "provenance": {},
      "research_relevance": true
    },
    {
      "schema_version": "1.0.0",
      "event_type": "ActionSubmitted",
      "event_type_version": "1.0.0",
      "payload_schema_ref": "action-submission.schema.json",
      "payload_schema_version": "1.0.0",
      "trigger": "immutable submission attempt",
      "source": "action_api",
      "logical_time": {},
      "identity_lineage": {},
      "causal_refs": {},
      "state_refs": {},
      "visibility": {},
      "provenance": {},
      "research_relevance": true
    },
    {
      "schema_version": "1.0.0",
      "event_type": "ActionValidated",
      "event_type_version": "1.0.0",
      "payload_schema_ref": "generic-event-payload.schema.json",
      "payload_schema_version": "1.0.0",
      "trigger": "deterministic validation",
      "source": "action_api",
      "logical_time": {},
      "identity_lineage": {},
      "causal_refs": {},
      "state_refs": {},
      "visibility": {},
      "provenance": {},
      "research_relevance": true
    },
    {
      "schema_version": "1.0.0",
      "event_type": "ActionRejected",
      "event_type_version": "1.0.0",
      "payload_schema_ref": "generic-event-payload.schema.json",
      "payload_schema_version": "1.0.0",
      "trigger": "failed validation",
      "source": "action_api",
      "logical_time": {},
      "identity_lineage": {},
      "causal_refs": {},
      "state_refs": {},
      "visibility": {},
      "provenance": {},
      "research_relevance": true
    },
    {
      "schema_version": "1.0.0",
      "event_type": "ActionAccepted",
      "event_type_version": "1.0.0",
      "payload_schema_ref": "generic-event-payload.schema.json",
      "payload_schema_version": "1.0.0",
      "trigger": "validated action selected",
      "source": "turn_controller",
      "logical_time": {},
      "identity_lineage": {},
      "causal_refs": {},
      "state_refs": {},
      "visibility": {},
      "provenance": {},
      "research_relevance": true
    },
    {
      "schema_version": "1.0.0",
      "event_type": "TurnCommitted",
      "event_type_version": "1.0.0",
      "payload_schema_ref": "turn-committed.schema.json",
      "payload_schema_version": "1.0.0",
      "trigger": "accepted action set sealed",
      "source": "turn_controller",
      "logical_time": {},
      "identity_lineage": {},
      "causal_refs": {},
      "state_refs": {},
      "visibility": {},
      "provenance": {},
      "research_relevance": true
    },
    {
      "schema_version": "1.0.0",
      "event_type": "ConflictResolved",
      "event_type_version": "1.0.0",
      "payload_schema_ref": "conflict-resolution.schema.json",
      "payload_schema_version": "1.0.0",
      "trigger": "simultaneous conflict set resolved",
      "source": "world_engine",
      "logical_time": {},
      "identity_lineage": {},
      "causal_refs": {},
      "state_refs": {},
      "visibility": {},
      "provenance": {},
      "research_relevance": true
    },
    {
      "schema_version": "1.0.0",
      "event_type": "BattleResolved",
      "event_type_version": "1.0.0",
      "payload_schema_ref": "battle-resolution.schema.json",
      "payload_schema_version": "1.0.0",
      "trigger": "battle function completes",
      "source": "world_engine",
      "logical_time": {},
      "identity_lineage": {},
      "causal_refs": {},
      "state_refs": {},
      "visibility": {},
      "provenance": {},
      "research_relevance": true
    },
    {
      "schema_version": "1.0.0",
      "event_type": "TerritoryTransition",
      "event_type_version": "1.0.0",
      "payload_schema_ref": "territory-state.schema.json",
      "payload_schema_version": "1.0.0",
      "trigger": "explicit territory state transition",
      "source": "world_engine",
      "logical_time": {},
      "identity_lineage": {},
      "causal_refs": {},
      "state_refs": {},
      "visibility": {},
      "provenance": {},
      "research_relevance": true
    },
    {
      "schema_version": "1.0.0",
      "event_type": "PopulationUnitTransition",
      "event_type_version": "1.0.0",
      "payload_schema_ref": "population-unit-transition.schema.json",
      "payload_schema_version": "1.0.0",
      "trigger": "population/unit lifecycle transition",
      "source": "world_engine",
      "logical_time": {},
      "identity_lineage": {},
      "causal_refs": {},
      "state_refs": {},
      "visibility": {},
      "provenance": {},
      "research_relevance": true
    },
    {
      "schema_version": "1.0.0",
      "event_type": "RNGDraw",
      "event_type_version": "1.0.0",
      "payload_schema_ref": "rng-draw.schema.json",
      "payload_schema_version": "1.0.0",
      "trigger": "research-relevant random draw",
      "source": "rng_service",
      "logical_time": {},
      "identity_lineage": {},
      "causal_refs": {},
      "state_refs": {},
      "visibility": {},
      "provenance": {},
      "research_relevance": true
    },
    {
      "schema_version": "1.0.0",
      "event_type": "ModelInvocation",
      "event_type_version": "1.0.0",
      "payload_schema_ref": "model-invocation.schema.json",
      "payload_schema_version": "1.0.0",
      "trigger": "model call begins/completes",
      "source": "model_adapter",
      "logical_time": {},
      "identity_lineage": {},
      "causal_refs": {},
      "state_refs": {},
      "visibility": {},
      "provenance": {},
      "research_relevance": true
    },
    {
      "schema_version": "1.0.0",
      "event_type": "MemoryOperation",
      "event_type_version": "1.0.0",
      "payload_schema_ref": "memory-operation.schema.json",
      "payload_schema_version": "1.0.0",
      "trigger": "memory read/write/transform",
      "source": "memory_service",
      "logical_time": {},
      "identity_lineage": {},
      "causal_refs": {},
      "state_refs": {},
      "visibility": {},
      "provenance": {},
      "research_relevance": true
    },
    {
      "schema_version": "1.0.0",
      "event_type": "MessageSent",
      "event_type_version": "1.0.0",
      "payload_schema_ref": "generic-event-payload.schema.json",
      "payload_schema_version": "1.0.0",
      "trigger": "authorized communication",
      "source": "diplomacy_api",
      "logical_time": {},
      "identity_lineage": {},
      "causal_refs": {},
      "state_refs": {},
      "visibility": {},
      "provenance": {},
      "research_relevance": true
    },
    {
      "schema_version": "1.0.0",
      "event_type": "CommitmentCoded",
      "event_type_version": "1.0.0",
      "payload_schema_ref": "commitment-codebook-entry.schema.json",
      "payload_schema_version": "1.0.0",
      "trigger": "blinded commitment coding",
      "source": "analysis_pipeline",
      "logical_time": {},
      "identity_lineage": {},
      "causal_refs": {},
      "state_refs": {},
      "visibility": {},
      "provenance": {},
      "research_relevance": true
    },
    {
      "schema_version": "1.0.0",
      "event_type": "ProjectionIssued",
      "event_type_version": "1.0.0",
      "payload_schema_ref": "authorized-projection.schema.json",
      "payload_schema_version": "1.0.0",
      "trigger": "authorized projection generated",
      "source": "projection_service",
      "logical_time": {},
      "identity_lineage": {},
      "causal_refs": {},
      "state_refs": {},
      "visibility": {},
      "provenance": {},
      "research_relevance": true
    },
    {
      "schema_version": "1.0.0",
      "event_type": "InterviewResponse",
      "event_type_version": "1.0.0",
      "payload_schema_ref": "interview-response.schema.json",
      "payload_schema_version": "1.0.0",
      "trigger": "isolated interview response",
      "source": "confidant_service",
      "logical_time": {},
      "identity_lineage": {},
      "causal_refs": {},
      "state_refs": {},
      "visibility": {},
      "provenance": {},
      "research_relevance": true
    },
    {
      "schema_version": "1.0.0",
      "event_type": "SecurityIncident",
      "event_type_version": "1.0.0",
      "payload_schema_ref": "security-incident.schema.json",
      "payload_schema_version": "1.0.0",
      "trigger": "security boundary violation",
      "source": "security_monitor",
      "logical_time": {},
      "identity_lineage": {},
      "causal_refs": {},
      "state_refs": {},
      "visibility": {},
      "provenance": {},
      "research_relevance": true
    },
    {
      "schema_version": "1.0.0",
      "event_type": "RunDisposition",
      "event_type_version": "1.0.0",
      "payload_schema_ref": "run-disposition.schema.json",
      "payload_schema_version": "1.0.0",
      "trigger": "run eligibility classified",
      "source": "run_controller",
      "logical_time": {},
      "identity_lineage": {},
      "causal_refs": {},
      "state_refs": {},
      "visibility": {},
      "provenance": {},
      "research_relevance": true
    },
    {
      "schema_version": "1.0.0",
      "event_type": "RedactionTombstone",
      "event_type_version": "1.0.0",
      "payload_schema_ref": "redaction-tombstone.schema.json",
      "payload_schema_version": "1.0.0",
      "trigger": "authorized privacy/consent redaction",
      "source": "archive_controller",
      "logical_time": {},
      "identity_lineage": {},
      "causal_refs": {},
      "state_refs": {},
      "visibility": {},
      "provenance": {},